Rank,Title,Author,Publisher,PublishDate,Price,Rating,ReviewCount,Link,Description
505,색 잘 쓰는 디자이너,"고바야시 레나, 강아윤",이지스퍼블리싱,2024년 08월,16200,9.9,31,https://www.yes24.com/product/goods/128725552,"색 잘 쓰는 디자이너. 주변 풍경을 찍은 ‘사진’에서 디자인 아이디어를 얻을 수 있다면?‘색 좀 잘 쓰고 싶은 디자이너’를 위한 배색, 글꼴 선택, 변형 디자인 노하우!디자인은 괜찮은데 어딘가 미묘하게 촌스럽다는 느낌이 들까? 2% 모자란 디자인을 단번에 채워..."
506,어디에나 있고 무엇이든 하는 알고리즘 이야기,문병로,김영사,2024년 06월,12150,,0,https://www.yes24.com/product/goods/128251064,어디에나 있고 무엇이든 하는 알고리즘 이야기. 세계적 알고리즘 전문가 문병로 교수가 소개하는인공지능 시대에서 길을 찾는 내비게이션!지식 라이브러리 ‘굿모닝 굿나잇’ 알고리즘 편“알 수 없는 알고리즘이 나를 여기로 이끌었다”유튜브에서 흔히 볼 수 있는 댓글이다....
507,안드로이드 모의해킹 입문,박도현,비제이퍼블릭(BJ퍼블릭),2024년 06월,24300,9.7,6,https://www.yes24.com/product/goods/128141387,안드로이드 모의해킹 입문. 화이트 해커를 꿈꾸는 당신을 위한안드로이드 모의해킹 길잡이 우리는 수많은 앱을 사용하여 편리한 생활을 즐기고 있다. 하지만 이토록 편리한 앱의 이면에는 언제나 보안 위협이 존재한다. 내가 사용하고 있는 안드로이드 앱의 보안 위협을 자...
508,초등부터 중등까지 한 권으로 끝내는 엔트리와 40개의 작품들,"전진아, 김수연",앤써북,2024년 06월,15930,9.8,13,https://www.yes24.com/product/goods/128122789,"초등부터 중등까지 한 권으로 끝내는 엔트리와 40개의 작품들. 『초등부터 중등까지 한 권으로 끝내는 엔트리와 40개의 작품들』 엔트리 최신버전을 반영했고, 최신기능 작품을 추가 교체하여 2판 개정판으로 새롭게 출간되었다. 책은 초중생 눈높이에 맞춘 실제 작품을..."
509,혼자 해도 프로처럼 잘 만드는 굿즈 제작 비법,박정아,한빛미디어,2024년 06월,19800,9.7,39,https://www.yes24.com/product/goods/127788111,혼자 해도 프로처럼 잘 만드는 굿즈 제작 비법. 굿즈 제작에 관심 있는 개인 제작자들을 위해 ‘진짜’ 굿즈 제작법을 알려주는 “굿즈 제작 교과서”빨간고래의 친절한 설명+생생 리뷰&특별 동영상 강의로 누구나 쉽게 굿즈를 만들 수 있다! ‘따뜻한 색감의 이야기가 ...
510,엔트리 인공지능 with 햄스터 로봇,"강윤지, 박찬규, 강성웅, 김원유, 심재민, 정보 더 보기/감추기, 강윤지, 박찬규, 강성웅, 김원유, 심재민, 김연구, 홍성용, 김경상, 정인재, 박광현",영진닷컴,2024년 05월,16200,9.5,4,https://www.yes24.com/product/goods/126829855,"엔트리 인공지능 with 햄스터 로봇. 엔트리와 햄스터 로봇으로 시작하는 인공지능 프로그래밍이제는 너무도 익숙한 인공지능(AI) 시대, 우리는 지금 인공지능으로 무엇을 할 수 있을까? 『엔트리 인공지능 with 햄스터 로봇』 개정판에서는 인공지능을 활용해 재미..."
511,Do it! 조코딩의 첫 웹 개발,"조동근, 조경민",이지스퍼블리싱,2024년 05월,15300,8.5,17,https://www.yes24.com/product/goods/126594782,"Do it! 조코딩의 첫 웹 개발. 코딩 교육 국내 1위 유튜버 ‘조코딩’이 알려 주는 웹 개발의 모든 것!코딩의 기초 지식부터 동물 소리 API, 게시판 구현까지진입 장벽은 깨부수고, 토대는 탄탄히 하는 초보자 맞춤 코딩 입문서! “AI 시대에는 질문하는 게..."
512,챗GPT 프롬프트 120% 질문 기술,"ChatGPT 비즈니스 연구회, 김모세",정보문화사,2024년 04월,13500,9.3,41,https://www.yes24.com/product/goods/126181417,"챗GPT 프롬프트 120% 질문 기술. 업무 속도를 10배 상승시키는 ChatGPT 진짜 활용법!ChatGPT의 등장은 전 세계에 ‘혁명’을 가져왔다. 인공지능은 더 이상 전문가들만의 전유물이 아니며, ChatGPT를 통해 누구든 인공지능을 손쉽게 사용하고 편..."
513,코딩 테스트 합격자 되기 - C++ 편,박경록,골든래빗,2024년 05월,40500,10.0,25,https://www.yes24.com/product/goods/126161512,"코딩 테스트 합격자 되기 - C++ 편. 코딩 테스트 합격자가 되는 가장 확실한 방법!프로그래머스 제공, 전문가가 모여 엄선한 빈출 100 문제로 철저하게 대비하세요!신입 사원 코딩 테스트를 준비하고 있는가? 코딩 테스트는 문제만 열심히 푼다고 통과할 수 없다..."
514,마인크래프트 초보자 가이드 New Edition,"Mojang Studio, 이주안",영진닷컴,2024년 04월,13500,9.6,15,https://www.yes24.com/product/goods/126010839,"마인크래프트 초보자 가이드 New Edition. Mojang에서 만든 새로운 마인크래프트 공식 가이드마인크래프트는 여러 가지 블록으로 이루어진 자원을 이용해 멋진 건축물을 만들거나, 무기를 만들어 적과 싸우는 등 다양한 활동을 할 수 있는 게임이다. 전 세계..."
515,컴퓨터 밑바닥의 비밀,"루 샤오펑, 김진호",길벗,2024년 03월,29700,9.7,44,https://www.yes24.com/product/goods/125299750,"컴퓨터 밑바닥의 비밀. 코드를 실행하면 컴퓨터 내부에서는 어떤 일이 벌어질까?운영 체제부터 CPU, 동기화, 입출력을 구현하는 원리까지,내 코드를 바꿔줄 컴퓨터 밑바닥의 비밀을 들여다보자!`어? 이 코드가 왜 돌아가지?`라고 생각해 본 경험이 다들 있을 것이다..."
516,만들면서 배우는 워드프레스,박현우,한빛미디어,2024년 03월,26100,9.7,30,https://www.yes24.com/product/goods/125131637,만들면서 배우는 워드프레스. 워드프레스 분야 베스트셀러 『만들면서 배우는 워드프레스』의 전면 개정판!워드프레스 6.3 버전 최신 업데이트 내용 반영AI를 활용해 자동으로 글 쓰고 구글 애드센스로 돈 벌기이 책은 워드프레스 분야 베스트셀러인 『만들면서 배우는 워...
517,가상 면접 사례로 배우는 머신러닝 시스템 설계 기초,"알리 아미니안, 알렉스 쉬, 최종일",인사이트(insight),2024년 02월,24300,9.0,12,https://www.yes24.com/product/goods/124939147,"가상 면접 사례로 배우는 머신러닝 시스템 설계 기초. “유튜브 동영상 추천, 에어비앤비 상품 추천, 뉴스 피드 생성 같은 머신러닝 시스템은 어떻게 설계할까?”이 책은 실제 서비스되고 있는 머신러닝 사례, 7가지 설계 접근법, 실제 시스템 설계에 참여한 엔지니어..."
518,Do it! 시뮬레이터+키트로 완성하는 아두이노 입문,박필준,이지스퍼블리싱,2024년 01월,22950,9.9,14,https://www.yes24.com/product/goods/124608984,"Do it! 시뮬레이터+키트로 완성하는 아두이노 입문. 아두이노 시뮬레이터로 회로를 만들고,동영상과 함께 키트를 조립하면고장 확률 0%, 성공 확률 100%!이 책은 아두이노를 처음 다뤄 보는 초등학생도 안전하고 쉽게 실습하며 아두이노 기초부터 응용까지 다 배..."
519,팅커캐드 3D 디자인&코딩,이상범,REXmedia(렉스미디어),2024년 01월,12600,,0,https://www.yes24.com/product/goods/124536057,팅커캐드 3D 디자인&코딩. 이 책은 3D 프린팅 기술의 활용을 위한 모델링 교육용 교재이다. 팅커캐드의 3D 디자인 기능을 기초부터 활용까지 단계별로 익힐 수 있다. Chapter별 3D 디자인 작품의 따라하기 및 응용문제를 수록하였다. Chapter별 Ju...
520,결정적 사건으로 배우는 암호학,"윤진, 이솔",골든래빗,2024년 01월,18000,10.0,6,https://www.yes24.com/product/goods/124213797,"결정적 사건으로 배우는 암호학. 이 한 권이면 누구든 ‘암호학’ 잡학러가 될 수 있다세상을 지탱하는 극비의 기술 암호학과 셜록 홈즈, 앨런 튜링, 비트코인이 어떤 관련이 있을까?정보의 속성과 인간 욕망의 결정체, 암호학 세계로 떠나보아요아서 코난 도일의 한 단..."
521,가상 면접 사례로 배우는 대규모 시스템 설계 기초 2,"알렉스 쉬, 산 람, 이병준",인사이트(insight),2024년 01월,32400,9.7,23,https://www.yes24.com/product/goods/124138645,"가상 면접 사례로 배우는 대규모 시스템 설계 기초 2. “구글 맵, 지메일, 아마존 S3 같은 대규모 시스템은 어떻게 설계할까?”글로벌 기업 시스템 설계에 몸담은 핵심 인물들의 노하우를 집대성했다!복잡한 대규모 시스템 설계는 어떻게 접근해야 할까? 중요한 건 ..."
522,AUTODESK INVENTOR 오토데스크 인벤터 2024 : 초급편,조성일,청담북스,2024년 01월,28800,,0,https://www.yes24.com/product/goods/123818817,AUTODESK INVENTOR 오토데스크 인벤터 2024 : 초급편. AUTODESK INVENTOR 2024 버전에 맞추어 개발된 개정판 교재이다. 저자가 20년동안 인벤터를 다루면서 쌓아온 노하우와 설계 및 교육 현장에서 다져놓은 노하우를 되도록 많이 수...
523,초등학생을 위한 디지털 드로잉 무작정 따라하기,"권동균, 김수민",길벗,2023년 11월,18000,9.6,10,https://www.yes24.com/product/goods/123688646,"초등학생을 위한 디지털 드로잉 무작정 따라하기. 혼자서도 척척!초등학생을 위한 디지털 드로잉 무작정 따라하기창의적인 어린이를 위한 디지털 드로잉 가이드북학교 수업 시간에도, 방과 후에 숙제를 할 때도 떼어놓을 수 없는 친구가 된 태블릿 PC! 더 유용하고 즐겁..."
524,된다! 7일 실무 한글,한정희,이지스퍼블리싱,2023년 10월,16200,9.8,46,https://www.yes24.com/product/goods/122598455,"된다! 7일 실무 한글. 하루면 기초 떼고 일주일이면 누름틀, 메일 머지까지 다룬다!업무 시간을 확 줄이는 마법 같은 노하우를 담은 실무 한글 입문서!공기업, 연수원에서 진짜 실무자들이 듣는 유료 강의를 책으로 만나 보세요!“한글 프로그램을 어렸을 때부터 많이..."
525,자동화 마케팅 무작정 따라하기,"신태순, 조수현",길벗,2023년 09월,19800,9.4,21,https://www.yes24.com/product/goods/122432412,"자동화 마케팅 무작정 따라하기. 고정비는 줄이고 성과는 높인다!소자본 기업의 시간과 비용을 아껴주는 콘텐츠 기반 자동화 마케팅대부분의 소규모 사업가가 더 많은 고객을 유입하기 위해 더 많은 광고비를 들이고, 사업 규모에 비례해서 인건비가 지속적으로 상승하는 비..."
526,나는 파이썬으로 머신러닝한다 2,"장병철, 이지항, 박지훈, 최정원",씨마스,2023년 09월,20700,9.9,35,https://www.yes24.com/product/goods/122320508,나는 파이썬으로 머신러닝한다 2. 나는 파이썬으로 머신러닝한다 2 약간 매운맛파이썬 문법과 머신러닝 기초 입문 도서 ‘나는 파이썬으로 머신러닝한다 1(순한맛)’에 이은 ‘나는 파이썬으로 머신러닝한다 2(약간 매운맛)’은 머신러닝 알고리즘의 핵심 원리와 실제 적...
527,가장 쉬운 이모티콘 만들기,정수진,정보문화사,2023년 09월,19800,9.9,51,https://www.yes24.com/product/goods/122141598,가장 쉬운 이모티콘 만들기. 포토샵으로 나만의 이모티콘 만들어 돈버는 방법!그동안 100개 넘는 이모티콘을 출시한 ‘연서’ 작가가 새로운 직업군으로 주목받는 이모티콘 작가의 세계를 면밀히 보여주면서 시작하는 이 책은 이모티콘을 처음 만들고자 하는 사람들이 쉽게...
528,코딩 교육을 위한 마이크로비트,아이씨뱅큐,제이펍,2023년 09월,16920,9.0,7,https://www.yes24.com/product/goods/122093181,"코딩 교육을 위한 마이크로비트. 재밌는 예제 중심의 마이크로비트 입문서!이 책은 처음 코딩을 시작하는 모든 친구를 위하여 하드웨어의 기본 설정부터 블록 코딩 방법까지 아주 친절하게 소개합니다. LED 깜빡이기, 나만의 펫 만들기, 식물에게 물 주기까지 친구들이..."
529,개발자와의 협업을 위한 IT 필수 지식,최선신,영진닷컴,2023년 08월,15300,9.9,29,https://www.yes24.com/product/goods/121991923,"개발자와의 협업을 위한 IT 필수 지식. IT 기획자, 관리자 업무에 필요한 IT 지식만 쏙쏙!개발자와 소통할 때 필요한 IT 지식 톺아보기IT 기획자, 관리자로서 개발자와 함께 일하기 위해서는 기본적인 IT 지식을 알고 있어야 합니다. 그런데 무엇을 공부해야..."
530,파이썬 생활 프로젝트 코딩,서승희,길벗,2023년 08월,16200,9.9,29,https://www.yes24.com/product/goods/121948165,"파이썬 생활 프로젝트 코딩. 12개의 실용적인 프로젝트 만들면서재미있게 배우는 파이썬 코딩이 책은 파이썬 기초를 넘어 다음 단계로 향하는 독자를 위한 실용적인 책이다. 파이참 편집기 설치부터 변수, 반복문, 조건문, 함수, 라이브러리 등 파이썬 기초 문법을 빠..."
531,상상을 실현하는 로블록스 게임 만들기,"강태훈, 장준하, D.LAB",한빛미디어,2023년 08월,19800,9.7,41,https://www.yes24.com/product/goods/121913198,"상상을 실현하는 로블록스 게임 만들기. 따라만 하면 손 안에 펼쳐지는 메타버스! 이제 나도 게임 개발자!로블록스는 3차원 공간에서 게임을 모델링하고 조작합니다. 익숙하지 않은 로블록스 스튜디오 화면과 영어로 직접 타이핑하는 루아 언어 코딩까지, 처음 로블록스 ..."
532,로블록스 타워맵 만들기,노페어(Nofair),디지털북스,2023년 08월,20700,,0,https://www.yes24.com/product/goods/121567188,"로블록스 타워맵 만들기. 이 책은 로블록스 게임 제작 입문서입니다. 게임 제작을 처음 해보는 분도 부담 없이 만들며 즐길 수 있는 ‘타워맵 만들기’를 주제로 하며, 일단 게임맵을 직접 만들어보며 흥미를 꾸준히 가지는 것을 목표로 합니다. 이 책은 로블록스 스튜..."
533,"HMI를 활용한 스마트팜, 스마트 팩토리 DIY","변정한, 박주광, 이새봄",생각나눔,2023년 07월,16200,,0,https://www.yes24.com/product/goods/120530104,"HMI를 활용한 스마트팜, 스마트 팩토리 DIY. ICT 플랫폼? 스마트팜·팩토리, 야, (코딩 모르는) 너두 할 수 있어!센서 구매 노하우, 센서 연결 학습 및 데이터를 통계/분석까지이 책 한 권만으로 기본 ‘스마트팜·팩토리’ 구축 가능책 뒷장 예제 다운로드..."
534,사실은 이것도 디자인입니다,김성연(우디),한빛미디어,2023년 07월,17100,9.8,63,https://www.yes24.com/product/goods/120235845,"사실은 이것도 디자인입니다. ‘넷플릭스를 보면 왜 시간 가는 줄 모를까’‘러쉬는 왜 SNS 운영을 중단했을까’‘왜 쿠팡 리뷰에는 별점이 있고 컬리에는 없을까’그러니까, 이게 다 의도된 디자인이라고?이 책은 디자인이라고 인식하지 못했던 디자인에 관해 이야기한다...."
535,견고한 데이터 엔지니어링,"조 라이스, 맷 하우슬리, 김인범",한빛미디어,2023년 06월,34200,9.2,39,https://www.yes24.com/product/goods/119712582,"견고한 데이터 엔지니어링. 실용적인 데이터 엔지니어링의 세계로 이끄는 최고의 안내서!고객 요구 사항에 맞는 시스템을 계획하고 구축하는 방법데이터 엔지니어링 분야가 빠르게 성장하면서 많은 소프트웨어 엔지니어와 데이터 과학자, 분석가가 해당 분야에 대한 포괄적인 ..."
536,모던 로보틱스,"케빈 M. 린치, 박종우, 이병호, 윤상웅, 권재운, 정보 더 보기/감추기, 케빈 M. 린치, 박종우, 이병호, 윤상웅, 권재운, 김영훈, 김종민, 임중빈, 손민준, 정진, 이상현, 양우성",에이콘출판사,2023년 05월,45000,10.0,1,https://www.yes24.com/product/goods/118754202,"모던 로보틱스. 이론적 개념과 실용적 응용을 모두 아우르는 로봇공학 분야에 대해 포괄적으로 소개하는 책이다. 운동학, 역학, 운동계획, 제어 등의 주제들과 더불어 최적화, 머신러닝 등 현대 기술 또한 다룬다. 책에 다양한 예시와 연습 문제가 포함돼 있고, 코드..."
537,이것이 C#이다,박상현,한빛미디어,2023년 05월,32400,9.1,30,https://www.yes24.com/product/goods/118685906,"이것이 C#이다. 전문가로 레벨업!C# 프로그래밍 완전 정복이 책은 C#의 기본, 고급 문법과 더불어 기초 클래스 라이브러리까지 다루고 있다. 총 22개 장으로, 앞서 배운 내용을 활용하면서 단계별로 학습할 수 있도록 구성했다. 입문자의 눈높이에 맞춰 친절하게..."
538,파이썬 라이브러리를 활용한 데이터 분석,"웨스 맥키니, 김영근",한빛미디어,2023년 05월,35100,8.7,31,https://www.yes24.com/product/goods/118523424,파이썬 라이브러리를 활용한 데이터 분석. 데이터 분석을 배우는 가장 완벽한 방법 파이썬 라이브러리 사용법부터 실제 데이터를 활용한 실습까지 믿고 보는 파이썬 데이터 분석 대표 도서가 3판으로 돌아왔다. 파이썬 판다스 프로젝트 창시자인 웨스 맥키니가 직접 설명하...
539,실무에 바로 쓰는 일잘러의 엑셀 입문,"후지이 나오야, 오야마 게이스케, 구수영",제이펍,2023년 04월,16920,9.7,15,https://www.yes24.com/product/goods/118500774,실무에 바로 쓰는 일잘러의 엑셀 입문. 아마존 재팬에서 50만 부 이상 팔린 엑셀 베스트셀러!엑셀 입문자 1만 명의 고충을 듣고 정리한 실무자의 노하우를 그대로 담았다(동영상 강의 제공)이 책은 엑셀 입문자들이 실무에서 흔히 겪는 크고 작은 실수에서 착안한 노...
540,마인크래프트 놀라운 발명품 만들기,Mojang Studio,영진닷컴,2023년 04월,14400,6.0,2,https://www.yes24.com/product/goods/118279214,"마인크래프트 놀라운 발명품 만들기. Mojang에서 만든 마인크래프트 건축 공식 가이드마인크래프트는 여러 가지 블록으로 이루어진 자원을 이용해 멋진 건축물을 만들거나, 무기를 만들어 적과 싸우는 등 다양한 활동을 할 수 있는 게임입니다. 전 세계 2억 명이 넘..."
541,소프트웨어 장인 정신 이야기,"로버트 C. 마틴, 정지용",인사이트(insight),2023년 03월,28800,10.0,1,https://www.yes24.com/product/goods/117713965,"소프트웨어 장인 정신 이야기. “세상을 떠받치는 장인으로 살고 싶은 개발자를 위해”첨단 인력이 가득할 것 같은 이미지와는 사뭇 달리 소프트웨어 산업은 ‘숙련자 부족’이라는 문제에 자주 시달려 왔다. 상대적으로 짧은 산업의 역사, 거품 붕괴, 교육 시행착오 등 ..."
542,HTML5 + CSS3 + JavaScript로 배우는 웹프로그래밍 기초,천인국,인피니티북스,2023년 01월,33000,9.0,2,https://www.yes24.com/product/goods/116981971,"HTML5 + CSS3 + JavaScript로 배우는 웹프로그래밍 기초. 웹프로그래밍 초보자도 쉽게 배우는 웹 개발 지침서!이 책은 웹프로그래밍을 처음 배우는 초보자들을 위해 기초부터 차근차근 설명한다. 1~3장에서는 HTML5를, 4~6장에서는 CSS3를,..."
543,오피스 초보 직장인을 위한 엑셀&파워포인트&워드&윈도우 11,"장경호, 권순만",영진닷컴,2023년 01월,19800,9.8,22,https://www.yes24.com/product/goods/116578742,"오피스 초보 직장인을 위한 엑셀&파워포인트&워드&윈도우 11. 오피스 초보 직장인을 위한 엑셀&파워포인트&워드&윈도우 11모든 버전(2010, 2013, 2016, 2019, 2021 365)에서 사용 가능한 오피스 통합 도서이다. 오피스 까막눈을 위한 193..."
544,"라즈베리파이 피코, 마이크로파이썬을 만나다",허경용,제이펍,2022년 12월,22500,10.0,1,https://www.yes24.com/product/goods/115817548,"라즈베리파이 피코, 마이크로파이썬을 만나다. IoT 시대, 쉽고 재밌게 따라 하며 배우는 라즈베리파이 피코라즈베리파이 피코의 장점은 저렴한 가격과 높은 하드웨어 성능이다. 접근성이 뛰어나며, 직접 다뤄보기 좋은 마이크로컨트롤러다. 또 하나의 장점은 프로그래밍 ..."
545,트랜스포머를 활용한 자연어 처리,"루이스 턴스톨, 레안드로 폰 베라, 토마스 울프, 박해선",한빛미디어,2022년 11월,35100,9.6,44,https://www.yes24.com/product/goods/115633781,"트랜스포머를 활용한 자연어 처리. 챗GPT처럼 자연어를 찰떡같이 알아듣는트랜스포머 완벽 해부트랜스포머는 우리 주변에 가득하다! 트랜스포머 아키텍처는 순식간에 자연어 처리 분야를 지배했고, 챗GPT가 전 세계를 강타했다. 이 책은 데이터 과학자나 프로그래머가 트..."
546,코딩 자율학습 나도코딩의 C 언어 입문,나도코딩,길벗,2022년 10월,23400,9.9,120,https://www.yes24.com/product/goods/113791780,코딩 자율학습 나도코딩의 C 언어 입문. 29만 명의 구독자와 2만 명의 수강생이 증명한 최고의 C 언어 강의나도코딩의 프로그래밍 학습 노하우를 그대로! 포인터에서 좌절하지 말고 C 언어를 배워 보자!유튜브와 인프런의 인기 강의를 한 권의 책에 담았다. 일상 ...
547,인공지능과 뇌는 어떻게 생각하는가,이상완,솔,2022년 09월,19800,9.3,58,https://www.yes24.com/product/goods/112250573,인공지능과 뇌는 어떻게 생각하는가. 인공지능과 뇌가 던지는 7가지 질문들―인공지능과 뇌를 통해 발견하는 지능의 비밀KAIST 신경과학-인공지능 융합연구센터장인 이상완 교수는 인공지능과 뇌과학의 최전선에서 활동하는 연구자이다. 구글 알파고 연구팀과 협업을 진행하...
548,현업 기획자 마이즈가 알려주는 게임 기획 스쿨,김현석,초록비책공방,2022년 08월,21600,9.9,20,https://www.yes24.com/product/goods/112207284,"현업 기획자 마이즈가 알려주는 게임 기획 스쿨. 게임 기획의 코어부터 기획자 마인드까지!20년차 현업 기획자가 알려주는게임 기획자가 알아야 할 거의 모든 것게임 기획 원론을 게임 실무와 가장 가깝게 적용한 쉽고 알차고 친절한 책이다. 피처폰을 시작으로 PC, ..."
549,케라스 창시자에게 배우는 딥러닝 개정 2판,"프랑소와 숄레, 박해선",길벗,2022년 08월,43200,9.7,7,https://www.yes24.com/product/goods/112012471,"케라스 창시자에게 배우는 딥러닝 개정 2판. 단어 하나, 코드 한 줄 버릴 것이 없다!단 한 권의 딥러닝 책을 선택한다면 바로 이 책이다!케라스 창시자이자 구글 딥러닝 연구원인 저자는 ‘인공 지능의 민주화’를 강조한다. 이 책 역시 많은 사람에게 딥러닝을 전달..."
550,디지털 일러스트 무기 아이디어 사전,"사이도런치, 김재훈",한스미디어,2022년 07월,16200,8.8,6,https://www.yes24.com/product/goods/111085305,"디지털 일러스트 무기 아이디어 사전. 고대 도검부터 현대의 무기까지무엇이든 그릴 수 있는 무기 지식 사전!캐릭터를 빛내주는 동서고금 무기 400선!이 책은 일러스트를 그리는 사람을 위한 ‘무기 지식 사전’입니다. 도검, 창, 해머, 도끼, 수리검, 활, 총 등..."
551,모두의 깃&깃허브,강민철,길벗,2022년 07월,18000,9.7,26,https://www.yes24.com/product/goods/110795446,"모두의 깃&깃허브. `여러 사람과 협업하고 있는데, 코드 관리는 어떻게 해야 하지?``내 코드를 예전 버전으로 되돌리고 싶어!``코드를 백업하고 싶어. 그리고 여러 버전으로 나누어 관리하는 기능도 필요해!`557개 일러스트와 그림으로 배우는 가장 쉬운 깃&깃허..."
552,애자일 조직은 이렇게 일합니다,"스티브 매코널, 백미진",인사이트(insight),2022년 06월,18000,8.6,7,https://www.yes24.com/product/goods/110282214,애자일 조직은 이렇게 일합니다. K-조직은 왜 애자일에 실패하는가 불확실성을 뚫고 성공하는 애자일 조직이 일하는 법 매월 수백만 명이 쓰는 토스의 송금 서비스와 쿠팡의 새벽배송은 수많은 실험과 실패에서 학습하는 피드백 루프에서 태어났다. 요즘 성과를 내는 조직...
553,솔리드웍스 50시간 완성 (조립·도면편),신동진,피앤피북,2022년 06월,18000,8.0,4,https://www.yes24.com/product/goods/110269462,솔리드웍스 50시간 완성 (조립·도면편). 수년간의 직업능력개발훈련 및 교육 노하우를 바탕으로 솔리드웍스를 처음 접하는 독자의 입장에서 작성된 교재다. 효과적인 학습방법으로 높은 학업성취를 달성할 수 있도록 내용을 구성하였다. 또한 학습진도에 적절한 연습도면을...
