Rank,Title,Author,Publisher,PublishDate,Price,Rating,ReviewCount,Link,Description
253,평범한 일상을 특별하게 남기는 스마트폰 사진 & 보정,최은영,시대인,2026년 06월,18000,10.0,10,https://www.yes24.com/product/goods/191477503,"평범한 일상을 특별하게 남기는 스마트폰 사진 & 보정. 복잡한 과정은 NO,초보자도 쉽게 따라 하는사진 촬영과 보정의 모든 것!클래스 101 누적 수강생 4,000명 이상,인스타그램 11만 팔로워의 마음을 사로잡은스마트폰 사진 보정 노하우 대공개!여행지에서, ..."
254,혼자 해도 프로 선생님처럼 잘 만드는 학교 수업 자료 with 제미나이,"김태훈, 손민지, 김한나",한빛미디어,2026년 06월,19800,10.0,8,https://www.yes24.com/product/goods/191321747,"혼자 해도 프로 선생님처럼 잘 만드는 학교 수업 자료 with 제미나이. 누구나 프로처럼 학교 수업 자료 만들기! 제미나이가 교사의 시간을 되찾아준다.제미나이, 나노바나나, Omni(구 Veo), 노트북LM, 구글 젬스, AI 스튜디오로 끝내는 교사 AI 워크..."
255,에이전틱 AI와 바이브 코딩 AI 개발의 정석 with 언리얼,"이영호, 이영훈, 탁광욱, 김현진, 나유선, 정보 더 보기/감추기, 이영호, 이영훈, 탁광욱, 김현진, 나유선, 박현상, 배주백",성안당,2026년 06월,39900,9.0,2,https://www.yes24.com/product/goods/191005623,"에이전틱 AI와 바이브 코딩 AI 개발의 정석 with 언리얼. 에이전틱 AI와 바이브 코딩AI 개발의 정석with 언리얼AI가 스스로 계획하고 실행하는 시대, 게임 개발도 달라진다. 이런 추세에 안성맞춤인, 최신 에이전틱 AI와 바이브 코딩을 언리얼 엔진 게..."
256,베테랑 AI 전문교사가 만든 가장 쉬운 패들렛 활용! Padlet(패들렛)으로 무엇이든 만들 수 있다 (교사를 위한 패들렛 수업 활용),"봉우리, 윤상준, 이호준, 황호연",광문각출판미디어,2026년 05월,17000,10.0,24,https://www.yes24.com/product/goods/190440092,"베테랑 AI 전문교사가 만든 가장 쉬운 패들렛 활용! Padlet(패들렛)으로 무엇이든 만들 수 있다 (교사를 위한 패들렛 수업 활용). 학생이 함께 만드는 패들렛!교과 수업, 동아리 수업, 국제 공동 수업 등 목적에 맞게, 학생 참여 수업을 위한 패들렛 게..."
257,AI 바이브 코딩 마스터,"정의석, 정윤식",영진닷컴,2026년 05월,32400,10.0,23,https://www.yes24.com/product/goods/189628201,"AI 바이브 코딩 마스터. AI 시대, 나만의 아이디어를 빠르게 실행시키는 방법!AI와 함께 빠르게 만들고, 정확하게 고치고, 실제로 배포하는 방법을 담은 실전 가이드입니다. Lovable을 중심으로 기획부터 UI 구현, Supabase 연동, Stripe 결..."
258,오픈클로,오창근,생능북스,2026년 05월,19800,9.9,14,https://www.yes24.com/product/goods/189477317,"오픈클로. 나만의 맞춤형 AI 비서, 오픈클로《24시간 일하는 나만의 맞춤형 AI 비서 오픈클로》는 복잡하고 어렵게만 느껴졌던 AI를 누구나 쉽게 활용할 수 있도록 만든 최신 버전의 오픈클로 실전형 가이드북입니다.단순히 AI를 사용하는 방법을 넘어, 내 업무와..."
259,하나면 다 된다 제미나이,앤미디어,성안당,2026년 05월,20700,9.6,28,https://www.yes24.com/product/goods/189438793,"하나면 다 된다 제미나이. 제미나이 3·나노 바나나 2·노트북LM까지,AI 콘텐츠 제작의 모든 것 하나면 다 된다 제미나이이미지 생성부터 영상 제작, 문서 분석과 프레젠테이션 자동화까지. 최신 구글 AI를 하나로 묶어 누구나 실무에 바로 활용할 수 있도록 안내..."
260,코딩 자율학습 FastAPI 파이썬 백엔드 개발 입문,신동현,길벗,2026년 05월,25200,,0,https://www.yes24.com/product/goods/189353153,"코딩 자율학습 FastAPI 파이썬 백엔드 개발 입문. 입문자에게는 훌륭한 백엔드 개발 교과서,시니어에게는 실무 중심의 FastAPI 입문서FastAPI는 최근 몇 년 사이 주목받고 있는 파이썬 웹 프레임워크입니다. 비동기 처리와 뛰어난 성능, 간결한 코드 구..."
261,게임으로 철학하기,"주자안, 정세경",현암사,2026년 05월,20700,10.0,8,https://www.yes24.com/product/goods/189335830,"게임으로 철학하기. 비디오 게임의 세계에는 낭만과 모험… 그리고 철학이 가득하다! 게임의 정의부터 예술성, 장르의 조건까지 게임의 세계를 이해하기 위한 23개의 철학 스테이지! 게임은 대중적인 취미다. 콘솔을 이용해 어려운 게임을 즐기는 사람이든, 휴대폰으로 ..."
262,모던 데이터 아키텍처 설계와 구현,"피트하인 스트렝홀트, 김영기, 김현진",책만,2026년 05월,29700,10.0,1,https://www.yes24.com/product/goods/189257260,"모던 데이터 아키텍처 설계와 구현. 대규모 데이터 확장에 따른 엔터프라이즈 데이터 아키텍처 운영과 관리 전략!모던 데이터 관리가 필요한 기업이라면 규모나 분야와 상관없이 반드시 소장하고 필독해야 할 책!오늘날 데이터 관리는 대격변을 겪고 있다. AI, 클라우드..."
263,"베테랑 AI 전문가가 만든 가장 쉬운 그록 AI 활용! Grok(그록)으로 무엇이든 만들 수 있다 (AI 비서 · 영상 만들기, 유튜브 수익화)","이현, 이민정, 이승현, 이나윤, 김성희",광문각출판미디어,2026년 04월,19000,9.9,49,https://www.yes24.com/product/goods/188838987,"베테랑 AI 전문가가 만든 가장 쉬운 그록 AI 활용! Grok(그록)으로 무엇이든 만들 수 있다 (AI 비서 · 영상 만들기, 유튜브 수익화). 유튜브 채널 설계부터 템플릿, 브랜딩&로고, SNS 이미지,광고, 음악 작곡, AI 영상 제작을 한 번에!그록 A..."
264,요즘 예체능 수업을 위한 에듀테크 활용법 223제,박래혁,앤써북,2026년 05월,20970,10.0,29,https://www.yes24.com/product/goods/188823173,"요즘 예체능 수업을 위한 에듀테크 활용법 223제. “음악·미술·체육 수업의 판이 바뀐다!”현직 교사가 엄선한 42가지 에듀테크 & AI 도구로 펼치는 223가지 압도적 에듀테크 활용법예체능 수업에서 빛나는 학생만 있는 건 아니다. 체육을 잘 못하는 학생, 음..."
265,이게 되네? 나노바나나 2 AI 비포&애프터 미친 활용법 82제,쌩초,골든래빗,2026년 05월,21600,10.0,97,https://www.yes24.com/product/goods/188600611,"이게 되네? 나노바나나 2 AI 비포&애프터 미친 활용법 82제. * 구글, ‘나노바나나 2’ 버전 전격 출시, 이제 차원이 다른 퀄리티를 제공하는 2 버전을 사용해보자!* 포토샵 없이 나노바나나 2로 5초컷으로 당장 써먹을 수 있는 상업용 이미지 만들기 비법..."
266,LangChain과 LangGraph로 만드는 LLM 애플리케이션 2/e,"벤 아우파스, 레오니드 쿨리긴, 옥경석, 박규성",에이콘출판사,2026년 04월,36000,10.0,5,https://www.yes24.com/product/goods/187572169,"LangChain과 LangGraph로 만드는 LLM 애플리케이션 2/e. 프로덕션에서 통하는 LLM 애플리케이션은 무엇이 다른가설계에서 운영까지, 개발 전 과정의 기준을 제시한다이 책은 오늘날 AI를 다루는 기업이 직면한 가장 큰 과제, 즉 프로토타입에서 프..."
267,에이전트 시대의 AI 시스템 설계,"발리아파 락슈마난, 하네스 막스 하프케, 류광",한빛미디어,2026년 04월,37800,9.7,12,https://www.yes24.com/product/goods/187519430,"에이전트 시대의 AI 시스템 설계. 프로토타입을 넘어 프로덕션으로!성공적인 AI 서비스를 위한 32가지 실전 패턴생성형 AI는 강력한 기능을 제공하지만, 이를 실제 프로덕션 환경에 안정적으로 도입하려면 환각, 비결정적 응답, 지식 공백 등 치명적인 한계를 극복..."
268,바이브 코딩 with 구글 안티그래비티,노성환,영진닷컴,2026년 04월,16200,9.8,34,https://www.yes24.com/product/goods/186939301,바이브 코딩 with 구글 안티그래비티. 코드 한 줄 몰라도 누구나 따라할 수 있는 바이브 코딩!대화 흐름을 따라가며 AI와 함께 만드는 나만의 서비스이 책은 AI 기반 개발 도구인 구글 안티그래비티(Google Antigravity)를 이용하여 만들고 싶은 ...
269,요즘 교실 혁신의 공식 AI·에듀테크 활용법 with 2022 개정 교육과정,진제헌,앤써북,2026년 05월,20970,10.0,6,https://www.yes24.com/product/goods/186936350,요즘 교실 혁신의 공식 AI·에듀테크 활용법 with 2022 개정 교육과정. 수업 설계부터 교사 업무 혁신까지 2022 개정 교육과정에 맞춘 가장 구체적이고 현실적인 AI·에듀테크 활용서!『요즘 교실 혁신의 공식 AI·에듀테크 활용법 with 2022 개정 ...
270,돈이 들어오는 무재고 위탁판매 쇼핑몰,전진수,혜지원,2026년 03월,15300,10.0,6,https://www.yes24.com/product/goods/183708092,"돈이 들어오는 무재고 위탁판매 쇼핑몰. 누구나 시작할 수 있는 가장 현실적인 부업무재고 위탁판매로 만드는 나의 첫 온라인 수익“나도 부업을 해 볼까?” 하지만 막상 시작하려고 하면 무엇을 해야 할지 막막하다. 자본이 없어서, 경험이 없어서, 시간이 부족해서 쉽..."
271,AI 시대 엄마가 먼저 알아야 할 최상위 공부법,"오주연, 김지예, 김현아",한빛비즈,2026년 03월,19800,10.0,16,https://www.yes24.com/product/goods/183572891,"AI 시대 엄마가 먼저 알아야 할 최상위 공부법. 2032~2033 입시의 핵심은 서·논술형 수능이다서·논술형 문제의 채점은 AI가 한다정답 찾기용 양치기식 문제풀이는 그만!질문하고 표현할 줄 아는 문해력이 핵심이다****김영호 국회 교육위원회 위원장, 이덕난..."
272,AI 자율학습 제미나이로 일 잘하는 법,성구(강성규),길벗,2026년 04월,23400,9.8,44,https://www.yes24.com/product/goods/182995232,AI 자율학습 제미나이로 일 잘하는 법. 실전 프롬프트 200제로 배우는 일상과 업무에 바로 쓰는 제미나이 활용법AI를 검색 도구에서 ‘함께 일하는 파트너’로 바꾸자!많은 사람이 AI를 검색이나 간단한 글쓰기 도구 정도로만 활용한다. 하지만 구글의 생성형 AI...
273,일머리를 설계하는 AI 워크플로 with n8n,이왕석,한빛미디어,2026년 03월,25200,10.0,111,https://www.yes24.com/product/goods/182629754,"일머리를 설계하는 AI 워크플로 with n8n. 퇴근을 앞당기는 갓생 치트키, n8n 단 하나면 충분!`비용 제로`로 구현하는 AI 워크플로 자동화매일 아침 수동으로 보내는 메일, 엑셀과 드라이브를 오가는 파일 정리, 놓치면 안 되는 카톡 알림까지… 혹시 아..."
274,변화를 기회로 만드는 AI력,정규진,민음인,2026년 03월,20700,10.0,15,https://www.yes24.com/product/goods/180954314,"변화를 기회로 만드는 AI력. “AI 사용법은 잊어라. AI와 협업하는 지능을 깨워라!” 삼성·현대차 등 200개 기술 난제를 해결한 26년 내공과 AI 혁신의 만남!실전에서 통하는 ‘능력 증폭’의 기술 삼성, LG, 현대차, SK이노베이션 등 국내 주요 기업..."
275,캔바 AI,"신승희, 앤미디어",생능북스,2026년 03월,21600,9.9,61,https://www.yes24.com/product/goods/180209658,"캔바 AI. 일잘러를 위한 모두의 파트너,2026 캔바 AI로 디자인 업무 능력을 높인다!직장인을 위한 업무 디자인부터 교육을 위한 콘텐츠 디자인까지, 캔바와 함께라면 기획 단계부터 제작, 수정, 완성까지의 모든 과정을 하나의 플랫폼에서 해결할 수 있습니다. ..."
276,에지 컴퓨팅과 피지컬 AI를 위한 라즈베리파이 5,허경용,제이펍,2026년 02월,27000,,0,https://www.yes24.com/product/goods/177866994,"에지 컴퓨팅과 피지컬 AI를 위한 라즈베리파이 5. `상상만 하던 에지 컴퓨팅과 피지컬 AI, 이제 책상 위 라즈베리파이 5로 실현하세요!`인공지능 기술이 클라우드를 넘어 우리 곁의 기기에서 직접 구동되는 `에지(Edge) AI`의 시대가 열렸다. 이 거대한 ..."
277,AI 게임 개발 with 코덱스,정윤지(유리링),한빛미디어,2026년 02월,28800,9.4,25,https://www.yes24.com/product/goods/177187498,"AI 게임 개발 with 코덱스. 코딩 몰라도 OK, 혼자서 `뱀서`급 게임 완성? AI와 함께라면 가능!혼자서도 프로처럼 AI 팀원과 캐릭터 제작부터 음원, 코딩, 배포, 수익화까지베테랑 게임 기획자 ‘유리링’이 알려 주는 혼자서도 팀처럼 AI를 다루는 방법..."
278,대체불가능,"파스칼 보넷, 김정민",제이펍,2026년 02월,19800,10.0,11,https://www.yes24.com/product/goods/177123635,"대체불가능. AI가 당신의 일을 대신할 순 있어도 당신의 ‘인간다움’은 대신할 수 없다모든 것이 자동화되는 세상에서 당신의 경쟁력은 무엇인가? AI를 다루지 못하면 도태되지만, AI만 잘 다루는 것으로는 부족하다. 이제 성공의 조건은 AI와의 단순한 공존을 넘..."
279,한 권으로 끝내는 실전 LLM 파인튜닝,강다솔,위키북스,2026년 02월,28800,10.0,1,https://www.yes24.com/product/goods/176913080,"한 권으로 끝내는 실전 LLM 파인튜닝. 실무 현장에서 바로 쓰는 파인튜닝ㆍPEFTㆍvLLM 서빙, 텍스트를 넘어 멀티모달까지!『한 권으로 끝내는 실전 LLM 파인튜닝』은 AI 기술의 최전선에서 필요한 LLM 파인튜닝의 모든 과정을 이론부터 실습까지 단계별로 ..."
280,AI 에이전트 마스터 클래스,김구현,한빛미디어,2026년 01월,23400,10.0,66,https://www.yes24.com/product/goods/175902524,"AI 에이전트 마스터 클래스. 랭체인의 기본기부터 최신 MCP 기술까지,‘살아 있는 AI’를 설계하는 가장 완벽한 로드맵단순한 챗봇을 넘어 스스로 판단하고 행동하는 ‘AI 에이전트’가 IT 업계의 새로운 표준으로 자리 잡고 있습니다. 이 책은 랭체인의 기초 문..."
281,AI로 완성하는 고수익 유튜브 운영 비법,현승효(디스이즈머니),시대인,2026년 01월,16200,9.9,22,https://www.yes24.com/product/goods/174682706,"AI로 완성하는 고수익 유튜브 운영 비법. 초보자도 성공하는 AI 시대, 유튜브 채널 운영 전략과 수익화!AI 도구로 제작 시간은 줄이고,알고리즘 작동과 검색 노출 원리를 익혀 단기간에 조회수를 끌어올리는 실전 가이드유튜브를 시작하고 싶지만 이미 늦은 건 아닐..."
282,AI시대 교육혁명 : 태재대학교,염재호,태재대학교출판문화원,2026년 01월,13500,,0,https://www.yes24.com/product/goods/171431187,"AI시대 교육혁명 : 태재대학교. 인류문명사의 대변혁기, 교육은 어떻게 진화해야 하는가?AI 전환시대의 교육혁명, 태재대학교의 도전에 주목한다태재대학교는 AI 전환시대에 부합하는 교육혁신을 이루고 21세기 한반도를 이끌어갈 글로벌 리더를 배출해 내겠다는 목표 ..."
283,직장인을 위한 AI 실무 엑셀,선양미,길벗,2025년 12월,22500,10.0,43,https://www.yes24.com/product/goods/169704757,직장인을 위한 AI 실무 엑셀. AI로 실무 완벽 대응! 실전! 비즈니스 엑셀 완전 정복 직장인을 위한 AI 실무 엑셀- 작업 속도는 누구보다 빠르게!업무 시간 단축 스킬 및 AI 자동화 활용 팁 대공개- 누구나 가능한 데이터 자동화!복잡한 가공부터 정리까지 ...
284,프롬프트를 만드는 프롬프트 GPTs & Gems,"민진홍, 국난아, 김진수",성안당,2025년 12월,24300,10.0,46,https://www.yes24.com/product/goods/169672758,"프롬프트를 만드는 프롬프트 GPTs & Gems. 프롬프트를 만드는 상위 프롬프트, 메타 플롬프트를 만들어 업무에 실속있게 활용할 수 있는 메타 프롬프트 지침서가 나왔다. 반복되는 업무를 템플릿화하여 사용할 수 있는, AI를 마치 전속 비서처럼 업무 도우미로 ..."
285,수노로 시작하는 AI 작곡,"강성우, 한나래",제이펍,2025년 12월,18000,8.8,23,https://www.yes24.com/product/goods/168840773,"수노로 시작하는 AI 작곡. 아이디어만으로 완성하는 나만의 음악 이 책은 아이디어만으로 부담 없이 작사·작곡을 시작할 수 있도록 구성했다. 화성학을 몰라도, 악기를 다루지 못해도 괜찮다. 챗GPT로 음악의 스타일과 분위기, 가사까지 구체적으로 설계한 프롬프트를..."
286,올라마와 오픈소스 LLM을 활용한 AI 에이전트 개발 입문,"서영배, 김병규, 임재봉",위키북스,2026년 01월,25200,3.0,2,https://www.yes24.com/product/goods/168727208,"올라마와 오픈소스 LLM을 활용한 AI 에이전트 개발 입문. 급작스럽게 다가온 AI 시대를 헤쳐나가기 위한 실용적인 가이드!이 책은 AI 전공자가 아닌 일반 개발자들이 AI 프로그래밍에 입문할 수 있도록 세심하게 구성했습니다. 단순히 랭체인과 에이전트, MCP..."
287,AI 자율학습 밑바닥부터 배우는 AI 에이전트,다비드스튜디오,길벗,2025년 12월,21600,9.6,20,https://www.yes24.com/product/goods/167584729,AI 자율학습 밑바닥부터 배우는 AI 에이전트. 화려한 프레임워크보다 중요한 것은 로직!기본에 충실하게 배우는 에이전트 설계 원리요즘 AI 에이전트가 대세입니다. 사용자를 대신해 방대한 자료를 조사·정리하고 복잡한 코드도 척척 작성하는 에이전트가 다양한 분야에...
288,대한민국 교육 르네상스 : 대전환시대 교육의 본질을 탐하다,"지미정, 김진관, 윤신영, 박미지, 윤여옥, 정보 더 보기/감추기, 지미정, 김진관, 윤신영, 박미지, 윤여옥, 김희수, 박선정, 강원빈, 이대형, 서지나, 서동욱, 하나, 남궁정, 임보라, 김하연",앤써북,2026년 01월,18000,9.9,25,https://www.yes24.com/product/goods/167476779,"대한민국 교육 르네상스 : 대전환시대 교육의 본질을 탐하다. 대전환시대 교육의 본질을 탐하다!실행-성찰을 통한 대한민국 미래 교육의 로드맵 제시『대한민국 교육 르네상스』는 교육 현장의 불편한 장면에서 시작해 비효율이 숙달된 현실을 넘어, 교사가 주도성을 회복하..."
289,AI 버블이 온다,"아르빈드 나라야난, 사야시 카푸르, 강미경",윌북(willbook),2025년 12월,22320,9.8,49,https://www.yes24.com/product/goods/167465671,AI 버블이 온다. “AI 버블에 면역이 있는 기업은 없다” ─순디르 피차이(구글 CEO)“우리는 지금 인공지능 버블 속에 있다” ─샘 올트먼(오픈AI CEO)★ “이 책을 읽지 않았다면 AI 주식에는 한 푼도 투자하지 말라!”★《타임》 선정 ‘AI 분야 가장...
290,그로스 해킹 (10주년 기념 증보판),"라이언 홀리데이, 고영혁",길벗,2025년 11월,19800,9.7,20,https://www.yes24.com/product/goods/167463337,"그로스 해킹 (10주년 기념 증보판). 10년 전 『그로스 해킹』이 시작한 혁신,이제 『그로스 해킹(10주년 기념 증보판)』으로 진화한다그로스 해킹의 기본부터 AI 시대의 그로스 해킹까지!지난 10년 동안 그로스 해킹은 기술 기반의 스타트업을 넘어, 데이터와 ..."
291,연필과 종이로 풀어보는 AI 딥러닝 수학 워크북 214제,톰 예,아티오,2025년 12월,17100,6.0,1,https://www.yes24.com/product/goods/167144757,"연필과 종이로 풀어보는 AI 딥러닝 수학 워크북 214제. 코딩 없이 연필과 종이만으로 딥러닝의 핵심을 완전정복한다.전세계 AI 전문가들이 극찬한 핸즈온 워크북으로 복잡한 코드와 프로그래밍 없이, 오직 손으로 직접 계산하며 딥러닝의 수학적 원리를 체득할 수 있..."
292,쉽게 배우고 바로 쓰는 에듀테크 첫걸음,"조종현, 박미지, 김승길",성안당,2025년 11월,16200,10.0,24,https://www.yes24.com/product/goods/165275154,쉽게 배우고 바로 쓰는 에듀테크 첫걸음. “왕초보 교사도 단 하루 만에 에듀테크와 친구가 된다!”“수업 현장에 꼭 맞는 에듀테크 안내서!”이 책은 미래 교육을 실천하기 위해 교사 스스로 디지털리터러시와 에듀테크를 활용 능력을 갖추는 것이 필수가 된 현실 속에서...
293,학교 업무가 쉬워지는 구글 스프레드시트 실전 가이드북,"김동호, 민동수, 박준택, 오보람, 윤수진, 정보 더 보기/감추기, 김동호, 민동수, 박준택, 오보람, 윤수진, 나혜진",씨마스21,2026년 01월,19800,10.0,33,https://www.yes24.com/product/goods/163495217,학교 업무가 쉬워지는 구글 스프레드시트 실전 가이드북. 새 학기 준비부터 학기 마무리 까지 핵심 기능을 한 권으로 끝!새 학기 시작에 필요한 학급 기초 자료를 만드는 업무부터 학기 마무리 성적 자동 완성 업무까지 현장에서 교사가 가장 필요로 하는 내용들을 학교...
294,챗GPT·퍼플렉시티·클로드·코파일럿·제미나이 다 잘함,이호정,리코멘드,2025년 11월,25200,9.6,5,https://www.yes24.com/product/goods/162322988,"챗GPT·퍼플렉시티·클로드·코파일럿·제미나이 다 잘함. ★ AI 시대, 하나로는 부족합니다!★ 진짜 일 잘하는 AI를 찾아 퇴근이 빨라지는 핵심 노하우를 97개의 활용 사례에 담았습니다!2022년 11월! 무엇이든지 묻기만 하면 원하는 대답을 척척 해 내는..."
295,일 잘하는 직장인,"일머리스쿨 (송경이,  유진희)",이지스퍼블리싱,2025년 11월,16200,9.9,19,https://www.yes24.com/product/goods/160153189,"일 잘하는 직장인. 직장생활을 하며 팀에 꼭 필요한 인재가 되고 싶다면?조직의 일머리를 설계하는 전문가, 일머리스쿨의 노하우를 한 권에 담았다!부푼 기대를 안고 회사에 입사했지만 실제로 마주한 직장생활은 그렇게 녹록지 않다. 해본 적도 없는 업무도 벅찬데, 동..."
296,AI로 만드는 나만의 그림책,"민진홍, 국난아",성안당,2025년 10월,22500,9.9,29,https://www.yes24.com/product/goods/155149859,"AI로 만드는 나만의 그림책. 인공지능 시대, 1인 출판의 길이 활짝 열렸다. 먼저 갈 것인가, 따라갈 것인가의 차이만 있을 뿐. AI 시대의 뉴노멀 창작 패러다임을 미리 체험하는 이 책은 실제 챗GPT로 글을 만들고 달리3와 미드저니로 일러스트를 만들고 캔바..."
297,요즘 당근 AI 개발,당근 팀,골든래빗,2025년 10월,19800,9.8,92,https://www.yes24.com/product/goods/154566057,"요즘 당근 AI 개발. ★ ‘당근’의 진짜 AI 활용과 개발 이야기★ 사용자 문제를 AI로 해결하는 당근 팀의 여정을 만나 보세요.‘AI로 과연 될까?’라는 질문은 ‘AI로 어떻게 하면 될까?’라는 고민으로 이어졌습니다. 엔지니어, 프로덕트 매니저, 운영 매니..."
298,요즘 바이브 코딩 커서 AI 30가지 프로그램 만들기,박현규,골든래빗,2025년 09월,21600,9.9,85,https://www.yes24.com/product/goods/153029475,"요즘 바이브 코딩 커서 AI 30가지 프로그램 만들기. ★ 월 20달러로 커서 AI를 300% 활용해보자, 당신의 아이디어를 바로 애플리케이션으로 만들어보자!★ 랜딩 페이지부터 블로그 만들기까지, 코딩 1도 몰라도 바로 시작할 수 있다!★ 커서 AI와 대화하면..."
299,VPython으로 시작하는 융합 시뮬레이션 수업,"송석리, 박솔애",길벗,2025년 09월,22500,10.0,1,https://www.yes24.com/product/goods/152815857,"VPython으로 시작하는 융합 시뮬레이션 수업. 과학, 수학, 정보에 대한 이해를 바탕으로 이뤄지는 창의적 융합 프로젝트 수업VPython(Visual Python)은 파이썬 프로그래밍언어로 작성된 코드를 3D 결과물로 보여주는 라이브러리이다. 복잡한 그래픽..."
300,AI 캡컷,"민지영, 문수민, 앤미디어",생능북스,2025년 09월,23400,9.9,41,https://www.yes24.com/product/goods/152369808,"AI 캡컷. 이미지+동영상 생성+영상 편집까지, AI 캡컷 하나면 OK!제작비 No, 수익은 UP! 아이디어를 완성하는 올인원 AI 캡컷매일매일 아이디어를 실현시켜 주는 올인원 AI 캡컷은 어렵고 부담스럽게만 느껴졌던 콘텐츠 제작 과정을 누구나 쉽게 한글 AI..."
301,"오늘을 남기는 기록, 스마트폰 사진 촬영&보정",민썸,이지스퍼블리싱,2025년 08월,18900,9.9,20,https://www.yes24.com/product/goods/150308211,"오늘을 남기는 기록, 스마트폰 사진 촬영&보정. 올렸다 하면 기본이 500만 뷰!22만 명을 사로잡은 사진/영상 크리에이터 ‘민썸’의 비법 공개!인스타그램 ‘좋아요’를 부르는 인물, 여행, 맛집, 야경 사진 보정법부터 느낌 있는 사진 구도, 촬영 명소, 아이폰..."
302,MS 365의 모든 것,"이상민, 김홍순, 강현욱",리더북스,2025년 07월,16200,10.0,8,https://www.yes24.com/product/goods/149371895,"MS 365의 모든 것. Microsoft 365 교육용 제품군 전반에 대한 실용적인 가이드북! OneDrive, Outlook & To do, OneNote, Teams, Loop, PowerPoint, Forms, Sway, Whiteboard, Clipc..."
