Rank,Title,Author,Publisher,PublishDate,Price,Rating,ReviewCount,Link,Description
706,제미나이(Gemini) 재미나게 활용하기,"강신진, 서완석, 오정택",BOOKK(부크크),2026년 04월,18300,,0,https://www.yes24.com/product/goods/186675967,제미나이(Gemini) 재미나게 활용하기. 제미나이(Gemini)의 기본 활용법인공지능 시대가 되었다. 세상이 변하면 사람도 변해야 한다. 생성형 인공지능(AI) 이용은 선택이 아닌 필수가 되는 시대다. 인공지능(AI) 기술은 개개인의 수준별 삶을 가능하게 합...
707,구글 AI 제미나이(Gemini) 200% 활용법,정의,BOOKK(부크크),2026년 04월,8800,,0,https://www.yes24.com/product/goods/186675889,구글 AI 제미나이(Gemini) 200% 활용법. 남들은 모르는 구글 제미나이 200% 초월 활용 법을 이 한 권에 모두 담았다. 이제 이 책에 숨겨진 꿀 기능들을 깨워보자!
708,"AI시대, 스토리텔링의 재탄생",김태원,파람북,2026년 04월,17100,10.0,3,https://www.yes24.com/product/goods/186141317,"AI시대, 스토리텔링의 재탄생. AI에 제압당할 것인가, AI를 컨트롤할 것인가?[클로드] [제미나이]와 함께 여는 스토리텔링의 신세계!지금, 생성형 AI라는 거대한 변화의 해일이 창작자들을 덮치는 순간이다. 베스트셀러 스토리 창작 가이드 『매혹적인 스토리텔링..."
709,AI 교양 수업,최윤철,생능북스,2026년 04월,16650,9.8,23,https://www.yes24.com/product/goods/185896235,"AI 교양 수업. 인공지능의 시대를 읽는 가장 완벽한 지도, 원리부터 미래까지 한 권에 담다자고 일어나면 새로운 기술이 쏟아지는 바야흐로 AI의 시대다. 이 책은 막연한 두려움과 환상을 걷어내고, 인공지능의 본질을 꿰뚫는 통찰을 제공한다. 튜링 테스트와 모라벡..."
710,"그냥 따라하다 배우는, 나노바나나 100선",이재용,비엘북스,2026년 04월,19800,,0,https://www.yes24.com/product/goods/185721925,"그냥 따라하다 배우는, 나노바나나 100선. 그냥 따라하다가 / 그냥 다 배우게 되는 / 초특급 나노바나나 입문서 - [그냥 따라하기 쉬운 100개]의 예제들 - [그냥 제공되는 100개]의 예제파일과 프롬프트. - [그냥 배우게 되는 100개]의 나노바나나..."
711,프롬프트 지옥에서 탈출하는 Claude Code 개발 자동화 시스템,"박현일, 조용현",BOOKK(부크크),2026년 03월,37000,2.0,1,https://www.yes24.com/product/goods/185523191,"프롬프트 지옥에서 탈출하는 Claude Code 개발 자동화 시스템. `AI한테 만들어달라고 했는데 맨날 다른 결과가 나와요.``수정하면 다른 곳이 망가져요.``프롬프트만 치다 하루가 끝나요.`이 말이 익숙하다면, 당신도 `프롬프트 지옥`에 빠져 있는 것입니다..."
712,AI와 철도 산업,우지환,커뮤니케이션북스,2026년 04월,12000,,0,https://www.yes24.com/product/goods/185459193,"AI와 철도 산업. AI는 철도를 단순한 이동 수단에서 지능형 플랫폼으로 바꾸고 있다. 자율 운행과 예지 정비, 수요 예측 등 기술 혁신을 통해 철도의 미래를 조망한다. 동시에 공공성과 인간 중심 가치, 노동 변화와 윤리 문제를 함께 짚으며 철도 지능 시대의 ..."
713,입상 교사만 아는 아무도 말해주지 않은 디지털교육연구대회 1등급의 비밀,강인성,앤써북,2026년 04월,15120,10.0,15,https://www.yes24.com/product/goods/184642019,입상 교사만 아는 아무도 말해주지 않은 디지털교육연구대회 1등급의 비밀. 전국 1등급 입상자가 알짜 비법까지 모두 직접 공개하는 디지털교육연구대회 보고서 작성의A to Z!디지털교육연구대회는 디지털 기반 교육혁신과 에듀테크 활용 수업 연구를 주제로 전국 교사들...
714,Play! SOLIDWORKS 솔리드웍스 2026 Master,원동현,청담북스,2026년 03월,33250,,0,https://www.yes24.com/product/goods/184510723,"Play! SOLIDWORKS 솔리드웍스 2026 Master. 본 교재는 『플레이! 솔리드웍스 2021 마스터』 이후 무려 5년 만에 선보이는 중급 단계 학습서로, 실무에서 실제로 활용되는 고급 설계 기법을 체계적으로 익힐 수 있도록 구성되었다.단순한 기능 ..."
715,투닝,김은지,문화출판더하다,2026년 03월,19800,,0,https://www.yes24.com/product/goods/184510719,투닝.
716,[할 수 있다!] 파워포인트 2021 활용,정동임,시대인,2026년 04월,10800,9.8,10,https://www.yes24.com/product/goods/184478217,"[할 수 있다!] 파워포인트 2021 활용. 파워포인트를 이용한 다양한 활용 방법을 배울 수 있다!파워포인트의 활용 범위를 넓혀줄 수 있는 파워포인트 활용서다. 발표용 자료 외에 이미지, 오디오, 비디오를 활용한 애니메이션 작업 등 다양한 방법으로 프레젠테이션..."
717,예제가 가득한 제미나이 길라잡이,이승우,정보문화사,2026년 04월,15120,9.9,25,https://www.yes24.com/product/goods/184402617,"예제가 가득한 제미나이 길라잡이. 엑셀, 워드 PPT, 이미지 생성까지 제미나이 실무 1000% 활용제미나이를 가장 똑똑하게 활용하는 방법을 가장 쉽게 알려주는 책이다. 제미나이를 더 제대로 사용하기 위한 프롬프트 프레임워크와 사용자 맞춤 설정에서 시작해 딥 ..."
718,LUVIT♥ 클로드와 함께하는 LLM 프로젝트,이승우,제이펍,2026년 04월,34200,10.0,2,https://www.yes24.com/product/goods/184312468,"LUVIT♥ 클로드와 함께하는 LLM 프로젝트. 클로드 API부터 RAG와 에이전트까지, 하나의 프로젝트로 끝내는 LLM 실전 개발이 책은 클로드 모델을 중심으로 LLM의 핵심 개념부터 실제 서비스 구현까지 이어지는 실전 개발 과정을 제시한다. 클로드 API와..."
719,스프링 부트 4 개발자 되기 + AI : 자바 편,신선영,골든래빗,2026년 04월,30600,8.0,2,https://www.yes24.com/product/goods/183794163,"스프링 부트 4 개발자 되기 + AI : 자바 편. * 누적 1만 부 판매 베스트셀러의 귀환!* 스프링 부트 4와 스프링 AI로 백엔드 개발의 A to Z를 정복하라!* 교강사님을 위한 강의 교안 PPT까지 제공!막막하기만 했던 백엔드 개발, 이제 『스프링 부..."
720,모두를 위한 진짜 쎈 바이브 코딩 with 인스타그램 클론 코딩,"전병우, 박윤철, 노마드코알라",리코멘드,2026년 04월,25200,9.8,26,https://www.yes24.com/product/goods/183754093,"모두를 위한 진짜 쎈 바이브 코딩 with 인스타그램 클론 코딩. ★ 상상이 서비스가 되는 압도적 경험, 모두를 위한 ‘진짜 쎈’ 시리즈!★ 코딩 지식 없이 AI에 물어보며 ‘인스타그램 기반 웹 서비스’를 뚝딱 만들고 운영하자!코딩에 대한 막연한 두려움을 단번..."
721,Vertex AI와 Gemini로 시작하는  생성형 AI 실전 개발,김민형,디지털북스,2026년 04월,28800,,0,https://www.yes24.com/product/goods/183714326,"Vertex AI와 Gemini로 시작하는 생성형 AI 실전 개발. Vertex AI와 Gemini를 활용한 생성형 AI 실전 가이드기초 API 기능부터 멀티 에이전트 설계와 배포까지, 현업의 노하우를 한 권에 담다불과 몇 년 전까지만 해도 AI는 데이터를 ..."
722,할 수 있다! 구글 크롬 기초&활용 with AI,IT교재연구팀,시대인,2026년 04월,10800,9.8,12,https://www.yes24.com/product/goods/183702987,할 수 있다! 구글 크롬 기초&활용 with AI. 왕초보도 쉽고 재밌게 구글 크롬 할 수 있다!구글 크롬 최신 AI 기능 반영AI 검색과 제미나이 활용을 한 번에 익히는 가장 쉬운 방법크롬 설치 방법부터 번역과 지도 앱 활용까지입문자를 위한 인터넷 가이드이 ...
723,30가지 예제로 따라 하며 배우는 ComfyUI 클라우드,"여승호, 신무경",제이펍,2026년 03월,19800,10.0,9,https://www.yes24.com/product/goods/183072607,"30가지 예제로 따라 하며 배우는 ComfyUI 클라우드. 아이디어를 영상으로 완성하는 AI 제작 워크플로 이 책은 ComfyUI 클라우드를 활용해 이미지 생성부터 영상 제작, 업스케일까지 AI 영상 제작의 전체 과정을 한 번에 익힐 수 있도록 구성했다. 복잡..."
724,"된다! 제미나이, 클로드, 챗GPT AI 챗봇 만들기","이재윤, 정해준",이지스퍼블리싱,2026년 03월,18900,9.5,15,https://www.yes24.com/product/goods/182958115,"된다! 제미나이, 클로드, 챗GPT AI 챗봇 만들기. 제미나이, 클로드, 챗GPT로 시작하는 업무 자동화!나만의 챗봇으로 일정한 퀄리티의 결과물을 얻는 법어느 정도 AI를 쓸 수 있게 되었다면 이제 속도를 올릴 차례! 이 책에는 제미나이, 클로드, 챗GPT의..."
725,AI 시대의 IT 로컬라이제이션,"정성희, 오오코시 히토미",커뮤니케이션북스,2026년 03월,12000,,0,https://www.yes24.com/product/goods/182892802,"AI 시대의 IT 로컬라이제이션. 생성형 AI의 등장으로 로컬라이제이션 산업의 구조가 빠르게 바뀌고 있는 상황에서, AI 번역과 자동화 기술이 글로벌 IT 서비스의 다국어 전략을 어떻게 재편하고 있는지 분석한다. 번역을 넘어 문화, 규제, 사용자 경험까지 고려..."
726,30일 완성 제미나이 업무 혁명,AI싱크클럽(이재만),루비페이퍼,2026년 04월,23400,9.9,45,https://www.yes24.com/product/goods/182813489,"30일 완성 제미나이 업무 혁명. AI 시대,새로운 기회를 잡는 사람들혹시 여러분의 하루도 이렇게 흘러가고 있지는 않나요? 아침에 출근하자마자 쏟아지는 이메일을 처리하느라 오전 시간을 다 보내고, 오후 내내 반복되는 보고서 작성과 데이터 정리에 시달리는 그런 ..."
727,생성형 AI 시대 수학 교육,"유주연, 정민주",커뮤니케이션북스,2026년 03월,12000,,0,https://www.yes24.com/product/goods/182476796,"생성형 AI 시대 수학 교육. 생성형 AI는 수학 문제 풀이와 학습 방식을 근본적으로 바꾸고 있다. 인공지능이 계산과 풀이를 대신하는 시대에 수학 교육이 무엇을 가르쳐야 하는지 질문한다. 맞춤형 학습의 가능성과 과도한 의존의 위험을 함께 살피며, 정답 중심 교..."
728,GPT-5와 ChatGPT로 시작하는 멀티모달 AI 프로그래밍 실전 입문,"후루카와 히데카즈, 최용",위키북스,2026년 03월,28800,,0,https://www.yes24.com/product/goods/182457817,"GPT-5와 ChatGPT로 시작하는 멀티모달 AI 프로그래밍 실전 입문. GPT-5 시대, AI 프로그래밍의 새로운 기준! GPT-5의 등장으로 AI는 텍스트를 넘어 이미지, 음성, 실시간 대화까지 아우르는 진정한 멀티모달 시대에 진입했다. 이 책은 Chat..."
729,A2A × MCP 멀티에이전트 오케스트레이션 실전,서지영,길벗,2026년 03월,29700,9.6,16,https://www.yes24.com/product/goods/182413407,"A2A × MCP 멀티에이전트 오케스트레이션 실전. 단일 모델 중심의 자동화를 넘어, 여러 에이전트가 협력해 문제를 해결하는 새로운 개발 방식을 경험해보자. 하나의 모델이 모든 것을 해결하던 방식에서 벗어나, 여러 AI 에이전트가 각자의 역할을 나누고 협력하는..."
730,제미나이로 구글·이미지·영상·자동화 진짜 잘함,이호정,리코멘드,2026년 03월,16920,10.0,21,https://www.yes24.com/product/goods/182116268,"제미나이로 구글·이미지·영상·자동화 진짜 잘함. AI 활용법 책은 넘쳤다. 이제는 진짜 잘할 때다!텍스트·이미지·영상·자동화, 구글 AI 생태계의 모든 것을 한 권에!제미나이를 둘러싼 책들이 쏟아지고 있다. 하지만 대부분은 기본 사용법이나 텍스트 활용에 그친다..."
731,상업용 AI 음악제작,최이진,노하우(도서출판),2026년 03월,29700,,0,https://www.yes24.com/product/goods/181819691,"상업용 AI 음악제작. `AI가 만든 노래, 누구의 재산입니까?`단순 `생성`을 넘어 저작권과 수익을 선점하는 4단계 실무 지침서누구나 생성 버튼 하나로 음악을 만드는 시대입니다. 하지만 그 음악으로 실제 돈을 벌고, 법적 보호를 받을 수 있는 사람은 극소수에..."
732,피지컬 AI 컴퓨팅 모빌리티 기초동작 편,"김석진, 박경민, 신승호, 김학진",골든벨,2026년 03월,28500,,0,https://www.yes24.com/product/goods/181126230,피지컬 AI 컴퓨팅 모빌리티 기초동작 편. ‘센서 편‘를 통해 세상을 인식하는 ‘눈’을 만들었다면 이제는 그 데이터를 바탕으로 스스로 움직이는 ‘몸’을 만들어야 한다. 『피지컬 AI 컴퓨팅 모빌리티 기초동작편』은 라즈베리파이와 파이썬을 기반으로 실제 움직이는 ...
733,언리얼 엔진5 모바일 게임 만들기,강상용,BOOKK(부크크),2026년 03월,32000,,0,https://www.yes24.com/product/goods/181125079,"언리얼 엔진5 모바일 게임 만들기. 이 책은 언리얼 엔진 5를 활용해 모바일 게임 프로그래밍을 단계적으로 배울 수 있는 실습 교재입니다. 한국폴리텍대학 서울정수캠퍼스 메타버스콘텐츠학과의 수업을 위해 제작되었으며, 기초부터 자신만의 게임을 완성할 수 있는 기틀까..."
734,"로봇, 그리고 로봇을 사랑하는 사람들","이브 헤롤드, 김창규",현암사,2026년 03월,18000,10.0,10,https://www.yes24.com/product/goods/181123366,"로봇, 그리고 로봇을 사랑하는 사람들. 로봇과 인공지능의 시대가 도래했다! 그들은 우리의 외로움을 덜어줄 수 있을까? 로봇 밀도 1위 국가에서 사는 우리가 꼭 읽어야 할 필독서! SF작가·공학박사 곽재식 추천! 정해진 시간이 되면 원반형 로봇이 움직이기 시..."
735,가상 면접 사례로 배우는 생성형 AI 서비스 설계,"알리 아미니안, 하오 성, 김지호, 조윤민",인사이트(insight),2026년 03월,30600,,0,https://www.yes24.com/product/goods/181114947,"가상 면접 사례로 배우는 생성형 AI 서비스 설계. “구글 번역기, AI 대화 서비스, 이미지 합성 같은 생성형 AI 서비스는 어떻게 설계할까?” 10개의 실전 사례를 직접 설계해 보며 배우는생성형 AI 서비스 개발 생성형 AI 분야에서 개발자로 일하는 사람이..."
736,아두이노제어 with generative AI,장인갑,내하출판사,2026년 03월,20000,,0,https://www.yes24.com/product/goods/181001457,"아두이노제어 with generative AI. 우리는 지금 코딩의 패러다임이 바뀌는 시대를 살고 있습니다. 불과 얼마 전까지만 해도 아두이노로 나만의 아이디어를 구현하려면 C언어의 복잡한 문법을 외우고, 두꺼운 매뉴얼을 뒤적여야 했습니다. 센서 하나를 작동시..."
737,안티그래비티 바이브 코딩 입문,박규하,로드북,2026년 03월,22500,10.0,11,https://www.yes24.com/product/goods/180485366,안티그래비티 바이브 코딩 입문. 입문자가 단 10일 만에 안티그래비티(Antigravity)를 활용하여 환경 구축부터 실시간 채팅 및 AI 감정 일기 배포까지 바이브 코딩(Vibe Coding)의 전 과정을 직접 따라하며 배울 수 있다. 특히 보너스 데이를 통...
738,n8n 업무 자동화 일잘러 되기,"메이허, 에디 유",골든래빗,2026년 03월,32400,10.0,30,https://www.yes24.com/product/goods/180468863,"n8n 업무 자동화 일잘러 되기. * 단 몇 개의 노드로 업무 효율을 1000% 높이는 일잘러가 되고 싶나요?* n8n을 이용하여 더 빠르고 쉽게 내가 원하는 작업을 자동화해요!* 웹 스크래핑, 주식·부동산 알림, GPT API, RAG 챗봇까지, 바로 쓰는 ..."
739,Security Guide 2026 (V.21) - 공격용 AI vs 방어용 AI,편집부,(주)화산미디어,2026년 02월,28500,,0,https://www.yes24.com/product/goods/180335965,"Security Guide 2026 (V.21) - 공격용 AI vs 방어용 AI. 생성형 AI가 산업 전반에 빠르게 확산되는 가운데, 스스로 판단하고 작업을 수행하는 ‘AI 에이전트’가 새로운 기술 패러다임으로 부상하고 있다. AI 에이전트는 디지털 업무 환..."
740,5분 제미나이,오종현,한빛미디어,2026년 02월,21600,9.9,34,https://www.yes24.com/product/goods/180162710,"5분 제미나이. `진짜 5분이면 되나요?` - 네, 됩니다.Google Gemini 하나로 업무·콘텐츠·일상까지 바꾸는 『5분 제미나이』* 실습 파일 + 55가지 실전 예제 + 95가지 활용 아이디어, 총 150가지 실습 프롬프트 수록* Q&A 오픈 채팅방, ..."
741,슬기로운 교사 생활 구글 클래스룸 수업 활용법,유수근,골든래빗,2026년 03월,24120,9.9,108,https://www.yes24.com/product/goods/180158155,"슬기로운 교사 생활 구글 클래스룸 수업 활용법. * 선생님, 오늘도 ‘종이’와 싸우다가 야근하셨나요?* 수업은 스마트하게, 업무는 칼퇴각!* 구글 클래스룸으로 시작해서 구글 워크스페이스, 제미나이, 노트북LM으로 완성하는 가장 완벽한 에듀테크 실무 가이드디지털..."
742,C++로 배우는 자료구조 및 알고리즘,"Frank M. Carrano, 송하윤",프로텍미디어,2026년 02월,44000,,0,https://www.yes24.com/product/goods/180138780,C++로 배우는 자료구조 및 알고리즘.
743,가장 쉬운 AI 앱 빌더 DIfy 실무 가이드,"오노 사토시, 두발타고",AK(에이케이 커뮤니케이션즈),2026년 02월,40850,,0,https://www.yes24.com/product/goods/179607096,"가장 쉬운 AI 앱 빌더 DIfy 실무 가이드. 코드 없이 내게 필요한 업무 자동화 앱을 만들자!쉽고 쳬계적인 로드맵을 통해 노코드 워크플로부터 RAG·에이전트·배포까지, Dify 하나로 LLMOps 기반 생성형 AI 앱 개발을 완성!"
744,코딩으로 피어나는 스마트팜 with 인공지능,"표정완, 장원규",딩코랩,2026년 02월,20900,,0,https://www.yes24.com/product/goods/179606150,"코딩으로 피어나는 스마트팜 with 인공지능. “코딩, 어렵지 않아요! 0과 1의 씨앗을 심으러 가볼까요?” 여러분, 솔직히 `코딩` 하면 뭐가 제일 먼저 떠오르세요? 검은 화면에 알 수 없는 영어가 잔뜩 써 있는 모습? 왠지 머리 아프고 딱딱할 것 같다는 ..."
745,"문제 해결의 힘, 컴퓨팅 사고력",한옥영,성균관대학교출판부(SKKUP),2026년 02월,25000,,0,https://www.yes24.com/product/goods/179605419,"문제 해결의 힘, 컴퓨팅 사고력. 문제 해결의 핵심, 컴퓨팅 사고력이 필수다! 오늘날 ‘문제 해결’은 모든 학문, 산업은 물론 일상생활에서도 빠질 수 없는 필수적인 역량이다. 기술이 너무나 빠르게 발전하고 점점 더 복잡해지는 이 시대, 우리는 크고 작은 문제들..."
746,"세상을 복제하는 공장, Physical AI 데이터팩토리",손병희,꾸그티처스,2026년 02월,13500,2.0,2,https://www.yes24.com/product/goods/178728913,"세상을 복제하는 공장, Physical AI 데이터팩토리. AI는 이미 충분히 똑똑하다.문제는 현실을 움직이지 못한다는 것이다.이 책은 Physical AI를 ‘로봇 기술’이 아니라 현실을 복제하고 학습하는 데이터 공장으로 정의한다.Physical AI 데이터..."
747,누구나 쉽게 따라 하는 디지털 & AI,"이정화, 남호정, 최상국, 하나",디지털콘텐츠그룹,2026년 02월,16200,,0,https://www.yes24.com/product/goods/178332725,"누구나 쉽게 따라 하는 디지털 & AI. 일상에서 바로 쓰는 부모님 맞춤 AI 교과서 이 책은 AI 기술이 낯선 시니어·실버 세대가 쉽고 편리하게 AI를 활용할 수 있도록 기획된 실용 중심의 개정판 안내서입니다. 챗GPT, 구글 제미나이(Gemini), 빅스..."
748,인벤터 설계,"홍성기, 강민정",성안당,2026년 02월,24300,,0,https://www.yes24.com/product/goods/178093876,"인벤터 설계. 인벤터는 3D 모델링에 최적화된 프로그램으로서 기계와 제품 등 다양한 분야에 활용되고 있으며, AutoCAD와의 완벽한 호환성을 바탕으로 설계 툴로서 꾸준히 발전하고 있습니다. 본 도서는 프로그램의 기초 기능 사용법, 다양한 예제를 통해 도면을 ..."
749,AI와 함께라서,"최원설, 이재하, 고은비",지식터,2026년 01월,18000,10.0,3,https://www.yes24.com/product/goods/177220266,"AI와 함께라서. 각 세대는 서로 다른 무기와 전략을 갖고 있지만, AI 시대의 승부는 무기의 강함이 아니라 함께 쓰는 방식에 달려 있다. AI는 방패이자 창으로서 팀을 지키고 길을 열며, 전략을 통해 공동의 목표로 나아가게 한다. 태도는 세대의 언어를 이해하..."
750,어르신들을 위한 스마트폰 기초교실,디지털콘텐츠그룹 편집부,디지털콘텐츠그룹,2026년 02월,14400,,0,https://www.yes24.com/product/goods/177123164,"어르신들을 위한 스마트폰 기초교실. 실생활 스마트폰 기초교실: 전화부터 키오스크까지 처음 사용자도 바로 쓰는 생활 밀착 안내서 이 책은 큰 글씨(A4, 12포인트)로 제작해 액티브 시니어·실버 독자분들이 편하게 읽을 수 있도록 구성했으며, 다양한 사진과 그림..."
751,인간중심 AI,권유빈,커뮤니케이션북스,2026년 02월,12000,,0,https://www.yes24.com/product/goods/177078746,"인간중심 AI. 효율 중심의 인공지능 개발이 낳은 불안과 한계를 짚으며, 인간을 다시 기술의 중심에 두려는 흐름을 분석한다. 인간 증강, 통제권, 책임이라는 관점에서 인간중심 AI의 가능성과 문제를 함께 살피고, 그것이 과연 해법이 될 수 있는지 비판적으로 질..."
752,허깅페이스로 배우는 멀티모달 모델,"이정인, 정우준",디지털북스,2026년 03월,19800,10.0,2,https://www.yes24.com/product/goods/177059661,허깅페이스로 배우는 멀티모달 모델. 세계 최대이자 대표 오픈소스 AI 플랫폼 허깅페이스로 시작하는 멀티모달 모델의 모든 것허깅페이스(Hugging Face)는 전 세계의 수많은 연구자와 기업들이 자신의 모델과 데이터셋을 공개하고 공유할 수 있는 대표적인 오픈소...
753,"누구나 쉽게 AI 작사 & 작곡 with 생성형 인공지능, 챗GPT, 수노, 유디오 (큰글자책)","현병욱(오땡큐), 신수진",시프트,2026년 02월,39000,,0,https://www.yes24.com/product/goods/176920892,"누구나 쉽게 AI 작사 & 작곡 with 생성형 인공지능, 챗GPT, 수노, 유디오 (큰글자책). AI로 시작하는 음악, 쉽고 재미있게 나만의 음악을 만들며, 음악의 매력에 빠져 보자!`AI에서 클릭 몇 번이면 음악이 뚝딱 완성되는데, 과연 책을 볼 필요가 있..."
754,프리미어 프로 + 애프터 이펙트 CC 2026 무작정 따라하기,"전은재, 민지영, 문수민, 앤미디어",길벗,2026년 02월,24300,9.7,26,https://www.yes24.com/product/goods/176914166,"프리미어 프로 + 애프터 이펙트 CC 2026 무작정 따라하기. AI 기능으로 더 빠르고, 스마트하고, 쉽게영상 편집이 가능해진 프리미어 프로 CC 2026AI는 대본 생성부터 편집, 오디오, 캡션 등 작업 제작 속도를 높여 짧은 SNS 영상부터 장편 영화까지..."
755,기본기부터 다시 새기는 러스트 특강,"욘 옝세, 장현희",인사이트(insight),2026년 02월,29700,,0,https://www.yes24.com/product/goods/176914164,"기본기부터 다시 새기는 러스트 특강. “알아 두면 능숙해지는 러스트 노하우”미국 백악관의 메모리 안전한 프로그래밍 언어 사용 권고, 리눅스 커널 개발 공식 언어 채택, 마이크로소프트에서의 점진적 도입 등 러스트는 시스템 프로그래밍 분야에서 C·C++의 대안으로..."
756,팔란티어처럼 해체하고 연결하고 장악하라,정관영,골든래빗,2026년 02월,21600,10.0,62,https://www.yes24.com/product/goods/176538801,"팔란티어처럼 해체하고 연결하고 장악하라. * 수십억 원을 쏟아부은 AI가 왜 당신 회사에선 ‘예쁜 쓰레기’일까?* 말만 번지르르한 챗GPT를 해고하고, 당장 ‘일하는 AI’를 고용하라!* 전 세계 1% 기업들이 목숨 걸고 도입하는 ‘팔란티어’의 1급 영업비밀 ..."
757,ISO 42001 인공지능 경영시스템 인증 바이블,강문정,한국인공지능검증원,2026년 01월,30000,,0,https://www.yes24.com/product/goods/176198950,ISO 42001 인공지능 경영시스템 인증 바이블. 중요한 단어는 “AI”가 아니라 “경영시스템”이다.많은 조직은 AI를 기술 프로젝트로 출발 시키는 경향이 있다. 데이터를 모으고 모델을 만들고 성능을 맞추는 것이라고 생각하는 경향이 있다. 그러나 AI는 시간...
758,생성형AI 프롬프트 디자인,한국생성형AI연구원,광문각출판미디어,2026년 02월,30000,,0,https://www.yes24.com/product/goods/175912211,생성형AI 프롬프트 디자인. 2024년 초판 발간 이후 불과 2년여 만에 생성형 AI 기술은 우리의 예상을 뛰어넘는 혁신적 발전을 이루었다. 단순히 텍스트를 생성하고 질문에 답하던 초기 생성형 AI는 이제 복잡한 업무를 자율적으로 수행하는 에이전틱(Agenti...
